comment_id,post_id,user_id,comment_text,comment_date
362,286,49,Attention bill indicate them image high might.,2025-06-29
363,230,6,Toward yes term write policy maintain book fire decide.,2025-08-12
364,99,50,Eye wide turn condition direction father consumer old they sport.,2025-01-06
365,494,13,Cover society time simple likely wish agent.,2025-06-19
366,471,30,Lay memory always describe animal front organization certainly very career.,2025-07-13
367,53,31,Most hair film base ask picture trade past door.,2025-08-30
368,373,33,About moment weight instead whatever until it work bed material.,2025-07-13
369,493,3,Home still far money daughter brother design one.,2025-05-23
370,61,13,Behavior phone hand item his turn.,2025-04-05
371,194,14,Add capital rest wall collection value into likely themselves reflect.,2025-10-23
372,469,22,Term budget everybody stand down idea second way discussion carry inside.,2025-07-22
373,155,10,Them fish final hair heavy federal down alone.,2025-07-17
374,2,24,Recognize card recognize degree morning industry enjoy ball call seek.,2025-03-19
375,349,10,Test show my sister left foreign late nor theory character.,2025-02-07
376,293,48,Big you performance wind behavior.,2025-07-25
377,34,7,Scene guess industry early single particular decision young from probably air.,2024-11-20
378,133,29,Card rate another short thus window crime catch draw talk.,2025-04-27
379,431,19,Nor pattern home perform hit discover million address.,2025-04-03
380,442,21,Throw same live clear head usually type.,2025-05-19
381,429,6,Staff major carry consumer result generation peace.,2025-04-11
382,75,35,Tell quickly fish especially wait difficult rise fall once whether.,2025-01-06
383,124,41,Star public huge time southern.,2025-10-01
384,233,18,Commercial trouble hospital exactly trip common somebody dinner.,2025-08-13
385,426,38,Give environmental control weight sell.,2025-01-25
386,310,27,Yes try amount summer especially issue.,2025-01-29
387,150,8,Democratic scene clear condition television doctor realize follow team model own.,2025-02-03
388,318,15,Decision personal tax run seek cause.,2025-09-07
389,110,1,Hand weight dinner station thus morning.,2024-11-30
390,308,29,Upon hit least build stay series final later individual.,2024-11-20
391,482,9,Sometimes day teacher late enough must word if only kitchen.,2025-01-19
392,25,19,Control bag kitchen public attention program seem big my.,2025-08-28
393,226,22,Crime black bag rich finish rule mother.,2024-11-21
394,259,7,General theory space even TV eat under need probably rich.,2024-12-08
395,75,38,Yes language under three rather.,2025-09-09
396,261,26,Apply enough call ahead usually live have.,2025-07-21
397,133,42,Ever voice fly seek put everybody lawyer it.,2025-08-26
398,3,16,Organization wear become lay involve away present.,2025-02-02
399,174,16,Fish person add win until lot.,2025-11-14
400,172,32,Explain raise strong physical you chance and.,2025-01-15
401,10,9,Since item condition local ability challenge true court.,2025-10-01
402,271,9,Which live glass air institution economy it pick character rock.,2024-12-02
403,115,14,High focus need happy decade performance special recently.,2025-07-11
404,449,32,Operation people contain ever form change watch national.,2025-03-02
405,1,3,Morning machine tough case pull article simple magazine pretty other.,2025-09-25
406,178,41,Painting interest population performance such why almost.,2025-07-23
407,94,20,Piece above bag late information collection pass.,2025-10-19
408,245,45,Defense especially by your provide shake subject find.,2025-07-21
409,204,5,Program walk enough majority walk.,2025-03-16
410,83,10,Give my pattern child risk main.,2025-01-23
411,398,49,Series within act test song speech speak.,2025-06-29
412,377,27,Bag son effect focus key address dark trouble mouth trouble.,2025-10-22
413,437,9,He herself goal other agent table use some.,2025-08-22
414,206,28,Under me one design get it some defense international end enough.,2024-11-19
415,436,38,Friend per consumer the about amount fast budget institution ten.,2025-04-07
416,405,24,Professional surface none opportunity.,2025-03-30
417,5,2,Top seven major than individual art.,2025-01-29
418,364,39,Set attack difficult remember few particularly discuss often certain along.,2025-03-15
419,91,45,Interview establish carry ahead phone pattern above road.,2025-09-30
420,453,15,Order PM participant attack painting partner bar bring financial free.,2025-10-17
421,265,14,Unit seven certainly issue choose develop none Mrs they.,2025-10-31
422,203,35,Activity light dark professor sometimes yes agree sound event language.,2025-04-08
423,312,34,Together report a fish thus north information magazine reach.,2025-04-10
424,278,44,Accept must idea believe process business enjoy trial deal evidence only.,2025-10-07
425,149,36,Much rule others bar cover policy go.,2025-08-16
426,328,30,Agree city card project Democrat standard few.,2025-03-05
427,167,19,West task movement painting movie something magazine include really.,2025-02-04
428,114,45,Security page need bag reach sign doctor daughter.,2025-05-31
429,277,42,Move cup very perhaps heavy thus thus over.,2025-10-18
430,410,21,Perform through outside herself summer white friend.,2024-11-29
431,402,34,Can may bar beyond rock.,2025-10-28
432,323,9,Difficult remain everything I through another.,2025-01-17
433,389,49,Tree lay cover teacher against Republican line claim.,2025-04-11
434,141,7,Sea during truth research need today.,2025-05-17
435,244,7,Certainly surface hold clear field either seat join.,2025-09-29
436,498,21,Series ahead treatment painting wind kitchen front.,2025-03-17
437,58,29,Strategy year significant early item find.,2024-12-01
438,181,24,Former cup first southern receive left rule cause high.,2025-05-08
439,159,27,Coach person successful officer foreign.,2025-04-27
440,293,37,Turn bring everyone world night save best.,2024-12-20
441,288,32,Study among four material movement once yard drop.,2025-10-03
442,124,8,Account Republican later draw southern none defense forward team maintain throw.,2025-11-15
443,294,13,Catch method card social I such us base place memory.,2025-10-15
444,193,19,Fight exist late within expect perhaps.,2025-05-21
445,81,35,Tend among suggest nor read design read sense fire organization.,2025-07-06
446,316,19,Outside positive program character expert wait order center.,2025-08-28
447,342,26,Process design draw choice onto reach director director try.,2025-05-13
448,214,9,Walk part water plan audience.,2025-02-24
449,101,48,Whom attack glass war need.,2025-02-18
450,55,43,Draw sport assume production man state white series.,2025-03-17
451,359,15,Against nothing memory accept story management.,2025-10-12
452,353,23,True particularly rule probably left main.,2025-09-27
453,208,22,American authority hundred majority indicate.,2025-08-05
454,152,40,Anyone production anyone movie top pay.,2025-10-15
455,479,18,Mouth trouble election good produce go class.,2024-11-19
456,395,47,Role nor alone remember election center film.,2025-02-23
457,435,37,Pick put fact blue unit.,2025-09-30
458,42,45,Writer address my sign street letter media floor girl.,2025-04-08
459,476,45,Student but movement kitchen development.,2025-03-03
460,214,36,Of from food cut score fact moment control recognize.,2025-11-08
461,170,37,View film prevent stuff truth analysis radio affect.,2025-02-09
462,24,31,Over fish threat authority fall remember party member reduce picture.,2025-03-23
463,427,32,Four happen artist guy early instead these.,2025-06-22
464,420,50,Certainly everybody travel scene than together figure deal move.,2025-11-04
465,349,48,There return after month recent discuss relationship have production best.,2025-07-07
466,428,31,Family lead blood east name simply that land specific low we.,2025-11-09
467,153,2,Alone plan boy professional interview smile once difficult yeah three.,2025-02-25
468,302,35,Treat political already color like never first student.,2024-12-22
469,62,20,Matter per note check during time whole say.,2024-12-19
470,103,4,Lose budget chair sometimes message health sister raise beyond end.,2025-09-26
471,25,33,Back where just wonder effect rock against car offer.,2025-04-02
472,126,35,Knowledge performance peace indicate lawyer learn amount.,2025-07-08
473,147,47,Clear style good activity garden continue goal time partner nation.,2025-08-14
474,434,34,What whole best resource director dinner.,2025-04-04
475,80,10,Side company brother create lay trip poor process.,2025-04-01
476,225,28,Those card letter majority finish.,2025-02-20
477,136,20,Hot understand future drug think discussion out.,2025-10-30
478,129,35,Customer threat western still Mr choice bag report three work.,2025-05-10
479,457,15,School article citizen cup offer morning financial state fish.,2025-02-02
480,461,43,Agent page him from happen around modern take race travel.,2025-02-13
481,256,39,That within middle to charge off body ask director.,2025-08-01
482,20,42,Fly without act talk same work.,2025-09-22
483,407,32,Mr return area change result talk only.,2025-10-07
484,309,16,Consider cell environment live go range much have.,2025-09-27
485,381,50,Heart ever trade president environmental player.,2025-10-19
486,466,15,Born free source near director message expert ball feel our.,2025-01-08
487,263,28,Program serious author occur establish top watch environmental middle in.,2025-01-22
488,457,12,Ground card fine kid hard each trade phone.,2025-06-02
489,205,6,Someone bar Congress course inside you wait.,2025-05-10
490,380,19,House final list stay include civil less position nice heavy school.,2024-12-05
491,408,48,Enjoy student politics some show.,2025-10-26
492,284,38,Color modern early policy any very wonder about turn phone.,2025-09-22
493,74,17,Feeling middle community lot thousand billion.,2025-11-13
494,296,7,Move pass art trade east pull.,2025-10-19
495,16,31,Partner instead ready here that third.,2024-12-04
496,482,36,Blue song music wind reason method there.,2025-07-02
497,94,34,Impact wife everyone partner save tonight fly bed improve.,2025-05-16
498,196,31,Report glass tree strong radio actually less become yourself.,2025-02-12
499,170,16,View expert data somebody owner physical left home show property able.,2024-11-26
500,339,21,Accept work right in capital charge lawyer claim detail.,2025-06-19
501,390,47,Happy maybe notice improve any.,2025-05-03
502,473,14,Choose include understand discussion apply talk.,2025-08-03
503,46,24,Name southern rule trial company.,2025-04-17
504,100,29,Specific almost risk feeling one close management.,2025-10-10
505,246,50,Police others perform rich area.,2025-03-09
506,474,26,Drug will reason however mind alone small despite discuss.,2025-01-29
507,95,16,Treat former wall happy something.,2025-02-21
508,267,45,Kind type center fall these range.,2025-10-28
509,396,41,Law whatever black research right sport picture.,2025-06-19
510,170,41,Crime third wear imagine huge truth rock market early message left.,2025-02-05
511,15,31,Including outside eat while environmental send thing region.,2025-01-15
512,97,29,Tough relationship program identify although art suggest training no member.,2025-07-07
513,126,23,Major simple leave inside make personal agent manager read available.,2025-08-16
514,345,27,This wrong large skin would ready.,2025-01-21
515,340,34,Next piece whose score throw would.,2024-12-24
516,53,5,Since right popular or five audience local forward.,2025-03-22
517,406,22,Not citizen daughter modern film arrive everyone candidate seem strong.,2025-04-01
518,114,15,Year stock clearly figure officer better kid.,2025-10-22
519,103,11,Order vote young right a theory.,2025-03-11
520,403,11,Manage significant reason air.,2025-11-12
521,467,18,Grow poor air want home most four pick.,2024-12-06
522,186,49,Knowledge should meeting one draw year politics marriage anything.,2025-09-01
523,111,38,Begin economic wrong whom fact car feel about finally.,2025-04-26
524,395,27,Much subject program military role individual sure test.,2024-12-31
525,88,47,Quickly meet approach two trial.,2025-02-06
526,151,7,Front plan because general gun adult news environmental.,2025-04-16
527,416,5,Work speak option century.,2025-04-21
528,274,47,Financial dinner seem drop sing still detail they run.,2025-10-06
529,304,28,Read defense work central this.,2024-11-22
530,341,33,Bill friend whose see raise receive suffer research minute.,2025-09-26
531,16,29,Continue consumer crime treatment crime rule.,2025-02-01
532,120,30,North but two bring free.,2025-03-26
533,173,29,Compare second activity interesting ago.,2025-07-02
534,45,3,Attack mother goal economy future employee reduce yes their industry.,2025-02-09
535,250,43,Reality half time policy knowledge quality task.,2025-04-27
536,247,23,Help food read head born room teach.,2025-07-25
537,122,12,With more lay today tend wear include small read write.,2025-11-15
538,228,42,Year as about animal message major whether during third.,2025-07-01
539,93,9,Reason identify its safe age various detail your owner business hot.,2025-07-17
540,278,9,Thank middle later nearly.,2025-09-19
541,294,43,Color citizen team husband face season since walk necessary trouble.,2025-02-08
542,306,16,Evening law save record seat concern start who role.,2025-11-03
543,465,37,Available power meet across drop lead morning future feel.,2025-02-01
544,340,30,Property however reality expert mean think customer.,2024-12-13
545,433,10,Environment day explain whether assume.,2025-11-06
546,332,43,Process billion member career feeling report professional my notice.,2025-02-16
547,50,27,Already whatever foot society catch bed term.,2025-07-28
548,24,40,Finish fine him politics next behavior part true tonight prepare material.,2025-09-30
549,224,39,Activity task international road garden sure city stop fire.,2025-09-06
550,39,31,Indeed today card newspaper rule account similar food moment magazine.,2025-03-09
551,63,39,Design yet author information article account reflect use myself model.,2025-09-10
552,236,28,Put church scientist land sort senior particular.,2025-08-27
553,91,15,Cold place message dinner federal note.,2025-11-11
554,79,38,Thank wrong guess lose heavy real knowledge real.,2025-10-06
555,64,49,Collection year usually president never he ok media suffer.,2025-02-07
556,51,25,Bad good executive father college magazine upon like.,2025-01-08
557,107,45,Agent note produce include surface total reflect against article will.,2025-01-07
558,79,13,Who catch air total head.,2025-07-02
559,340,30,Get thing simply idea weight.,2025-07-08
560,267,21,At pass along official range white sound seat say book.,2025-11-11
561,25,5,Protect walk language operation nothing fact resource great.,2025-02-24
562,176,26,Both born wind able chair upon visit.,2025-07-19
563,212,5,Near range simple any allow.,2025-02-01
564,308,27,Agree home situation himself parent southern later.,2025-10-12
565,328,26,Party return conference worker such least direction by reveal economic.,2025-06-12
566,166,33,Necessary name wish newspaper manage father win human mouth wrong.,2025-06-01
567,474,24,Article coach toward system every sometimes.,2025-09-30
568,260,24,Season difficult store positive seem lot own scientist real generation.,2025-08-13
569,405,44,Rule eye allow situation easy defense.,2025-03-13
570,499,13,Indeed today approach late issue dog hair.,2025-01-10
571,461,13,Push follow know soon partner game movement become perform.,2025-04-25
572,366,42,Girl plant not of film.,2025-09-27
573,277,8,Our partner son green.,2025-06-28
574,439,44,According piece soldier practice matter source.,2025-02-12
575,374,35,Billion card so last buy billion just.,2025-08-15
576,143,47,Customer staff sign represent take Congress.,2024-12-16
577,254,35,Total sit table bad generation fund think clearly knowledge.,2025-10-25
578,124,36,Check job huge thank card.,2025-03-07
579,459,14,Example learn across old collection board within dinner certainly center.,2025-02-12
580,471,20,Fall resource staff today simply moment account majority side.,2025-05-17
581,472,19,During politics sing trade after question great trial himself.,2025-07-23
582,470,33,Red either dark example now.,2025-08-09
583,474,39,Card animal myself black because itself choose mother like.,2025-10-07
584,321,47,Close box themselves suggest because set fire guy social.,2025-08-26
585,361,40,Approach next necessary right necessary.,2025-07-05
586,75,1,Course reality speech week Congress when.,2025-06-02
587,254,23,I compare chance somebody seven.,2025-07-09
588,465,15,Play hard painting include deal receive catch probably establish.,2025-09-20
589,458,1,This design relationship chance mind various.,2025-03-24
590,127,21,Different amount player audience professional sense particularly raise.,2025-01-03
591,407,39,Measure series too significant population full color.,2024-12-08
592,336,48,Suffer up executive from need physical.,2025-01-01
593,497,21,Put summer at own simple or occur price.,2025-03-03
594,221,44,Listen consider own central turn speech plant have.,2025-07-28
595,404,12,Adult across person leader what four.,2025-07-23
596,130,27,Them apply north far four.,2025-07-22
597,365,21,Question bring body writer hear.,2025-07-13
598,224,32,Store whose may they today capital she.,2025-05-26
599,239,2,Station significant expert yes similar.,2025-01-10
600,314,40,Rest ready claim fight product.,2025-04-17
601,486,48,Section page above music speak discuss nor hit start.,2025-05-23
602,252,32,Physical son phone service.,2025-03-19
603,12,11,Save successful arm everyone push type dog wind.,2024-11-23
604,56,28,Phone western receive better possible agreement or name.,2025-05-16
605,351,26,Where such green toward attorney raise nor mention maintain.,2025-03-25
606,281,1,Describe fish throughout charge not grow hair show.,2024-12-03
607,496,35,Measure player carry raise great front.,2025-08-20
608,244,23,Character serve stop short shoulder phone type.,2025-08-13
609,283,49,Church cause size general use score figure edge fine.,2025-08-19
610,485,45,No suffer born dark option use without capital here guess.,2025-01-11
611,321,18,Keep me attention town suggest.,2025-10-22
612,59,6,Market century beautiful writer career worry easy tonight.,2024-11-22
613,48,8,No boy director material although itself drop ability either third.,2025-08-17
614,118,19,Other manage account man pick.,2025-09-22
615,216,40,Mind green cause value police him about involve network great.,2025-06-23
616,340,7,Offer knowledge other color film sea rich with interview name.,2025-10-31
617,367,2,Film trade president key painting instead something.,2025-06-07
618,298,14,Meeting left staff million clear.,2025-09-16
619,414,50,Second girl record air actually adult collection south week.,2025-01-18
620,164,5,Assume store never reality window bar by record.,2025-02-04
621,382,31,Air view talk summer become room attorney that information final.,2025-03-07
622,68,37,Play buy true she show development former space let happen must.,2025-08-27
623,442,50,Region respond walk win right spend.,2025-03-27
624,400,3,Walk establish field around spring sport information indicate majority election.,2025-04-16
625,114,24,Month positive accept bad nature audience someone.,2025-09-25
626,122,48,Including win trip give you from.,2025-04-12
627,192,35,Per see growth member true their accept cost way moment season.,2024-11-29
628,406,29,Lay partner capital several your then little rate.,2025-07-19
629,109,48,Knowledge become many will personal cold.,2025-01-24
630,369,3,Hair carry less deal grow fly environment.,2024-12-16
631,328,9,Card popular key its heavy final forget hold must.,2025-09-29
632,329,16,Attack door message capital anyone investment seek pick student cover.,2025-08-08
633,269,32,Provide direction officer paper mean human true goal before.,2025-09-19
634,87,31,Hear company question wear sport skin sea indicate enjoy.,2025-10-21
635,72,10,Not view though owner study real notice skill summer politics.,2024-12-06
636,87,31,Pull suffer next director authority cup produce around.,2025-10-31
637,192,46,Risk short last official how.,2024-12-16
638,173,35,Tv herself not pretty bed season who discuss local itself.,2024-12-16
639,70,12,Price dog son although task beyond money change half yourself.,2025-02-17
640,472,41,Involve almost program carry activity week fear these war keep there.,2025-07-05
641,302,46,Follow into civil interview likely truth always poor up site.,2024-12-16
642,472,15,Pattern job author general down.,2025-08-04
643,353,17,Throughout doctor social bad ever second.,2025-07-22
644,463,6,Trip student hear TV boy her cultural before program modern.,2025-02-16
645,229,42,Direction set Democrat population research.,2025-10-09
646,409,16,Religious scientist generation section lot tend.,2024-12-27
647,284,26,My news alone structure choose hope difficult unit word performance.,2025-02-26
648,477,8,Stock return on large scientist lay degree stop building.,2024-11-23
649,446,7,Office program time way area few save reveal real.,2024-12-13
650,27,10,Author we through unit with scientist suddenly.,2025-02-18
651,304,8,Open ago report way minute their lot generation represent little.,2025-02-16
652,327,32,Line husband friend success challenge get only.,2025-08-09
653,123,5,Business painting parent several other day town outside present animal.,2025-08-30
654,426,18,Agreement listen cause pressure step.,2025-03-11
655,472,27,Job despite church page these claim method hard summer whatever.,2025-06-07
656,188,2,Fight and most run learn our middle involve.,2025-01-09
657,221,27,Decide do despite his picture.,2025-06-14
658,24,34,Five compare fire talk six push.,2025-11-10
659,224,36,Operation year several child peace.,2025-09-13
660,454,10,Religious vote add quality weight behavior list car kitchen happy.,2025-11-17
661,85,40,Population why reason scientist message.,2025-06-25
662,433,15,Foreign develop require expect have blue attention door.,2024-12-29
663,325,12,Month effort event recognize its example dream minute meeting result.,2025-04-30
664,209,18,Nothing wonder summer store natural car draw or.,2025-01-28
665,136,9,Teach during strong thank.,2025-06-25
666,73,27,Remember material prevent light rise either model.,2025-04-17
667,365,30,Bank high such news message themselves.,2025-09-26
668,225,39,Reality chance ever protect never quickly seek value occur.,2025-01-26
669,396,38,New apply church rather question face media decide free central.,2025-07-08
670,162,29,Raise control left least by great put hotel design threat.,2025-01-28
671,160,47,Risk animal benefit stage opportunity commercial be she friend.,2025-11-12
672,215,28,Together realize however exactly develop.,2025-01-23
673,251,8,Its opportunity return blood woman paper down never.,2025-07-11
674,377,26,Support say short range.,2025-01-13
675,485,46,The cover quality sea happen often since arm else we.,2025-06-23
676,159,15,Exactly month bank science around huge a challenge.,2025-07-15
677,141,39,Learn opportunity get three score positive party baby.,2025-03-31
678,292,49,Still population significant those activity share statement traditional.,2025-10-08
679,385,37,Early financial rich this decade senior state walk.,2025-06-23
680,6,37,Authority sense themselves trip fund his like.,2024-11-23
681,430,2,Rest position Mr interest dark day contain must whatever fall.,2025-02-07
682,388,46,Human particularly amount man certainly usually perform read recent happy.,2025-11-12
683,406,15,Only small himself hold body.,2025-03-23
684,62,8,Perhaps great social table often half.,2025-04-27
685,405,46,Choose term argue officer father game allow movie participant accept.,2025-03-02
686,84,28,Give dark century police total concern budget.,2025-06-11
687,228,23,Example stage feel feel hot force.,2025-05-23
688,466,29,Hot say value top can bed keep.,2025-07-02
689,450,19,Catch film smile minute direction exist.,2025-06-09
690,465,4,Official consumer difficult somebody section.,2025-02-07
691,310,30,His stop great administration.,2025-01-15
692,405,4,Newspaper boy every staff organization difficult guy market.,2025-11-17
693,224,23,He he stop thank chair kid specific thank raise movement.,2025-03-27
694,187,49,Or apply home stand raise.,2025-09-10
695,270,45,Citizen loss thing answer leave left weight.,2025-04-03
696,489,9,Avoid bag particularly today large else child then.,2025-05-29
697,198,2,Test hot beautiful local two myself than relationship skill international.,2024-12-23
698,221,41,Party husband them author court add me.,2025-06-13
699,402,1,Significant according take address design after whether outside newspaper.,2025-10-26
700,395,8,Many industry rise office.,2025-10-14
701,275,9,Little hit major follow major.,2025-03-27
702,208,10,Throughout identify now ask whether.,2025-02-27
703,427,10,Ok minute into energy foot last strong knowledge.,2025-05-16
704,417,11,Mother account recognize view thus fine natural.,2025-05-20
705,467,3,Right north resource size threat artist today cup impact.,2025-05-24
706,75,31,Attention day prepare human.,2024-11-26
707,150,45,Hope special role skin may sell.,2025-07-06
708,479,31,Always him force whole more ask apply support position.,2024-12-26
709,391,45,Fine Mr common building window seek imagine structure far.,2025-08-25
710,375,15,Consider wind specific experience lose support look during wish series.,2025-07-13
711,207,17,Strategy white its his least machine career across approach.,2025-03-15
712,442,38,At first significant better show change skin.,2025-03-14
713,378,42,Understand newspaper light evidence production both better least management sister.,2025-05-08
714,211,22,Travel begin lawyer marriage enough hot these.,2025-10-29
715,471,40,Huge above senior industry between series never behind easy enjoy.,2025-05-28
716,486,3,Mother not identify popular relationship policy knowledge may indeed.,2025-07-14
