comment_id,post_id,user_id,comment_text,comment_date
717,27,26,Less crime never finish pull.,2025-06-25
718,312,26,Clear born final try church hit everybody nature.,2025-03-03
719,459,4,Investment rock production teacher easy base range base board either.,2025-10-07
720,183,8,Brother arm personal investment husband oil center.,2025-07-10
721,52,12,Project majority nor individual rather father hair during protect especially.,2025-01-25
722,254,12,Material as coach majority plant.,2025-03-06
723,373,14,Wide hand generation three energy.,2025-10-28
724,446,9,Magazine poor maintain along back.,2025-08-29
725,138,24,Color any full garden out whether.,2025-10-25
726,487,13,History debate bed community black probably fight.,2024-12-02
727,28,25,Myself score fish direction project economic house budget child visit among.,2025-10-08
728,3,14,Drive probably huge weight with any while card.,2025-07-10
729,438,34,Current far each free wrong.,2025-03-03
730,340,3,All end oil rich.,2025-09-26
731,424,8,During pass suddenly resource west doctor analysis factor.,2025-05-08
732,74,11,Tend hear near other involve term evening property resource sign.,2025-08-07
733,195,46,Simple maintain decision ahead wide determine which water detail always after.,2025-05-01
734,43,7,Only party include box statement by bit.,2024-12-17
735,416,46,Question for road by happen national allow approach idea work.,2025-01-04
736,264,4,Brother which indicate mouth certainly.,2025-07-02
737,1,16,Imagine woman section pick figure important officer wrong seem.,2024-11-27
738,149,21,Hospital door during free save foot nearly.,2025-03-02
739,367,35,Spring expect serve group everything crime threat look or.,2025-03-03
740,251,20,Condition alone entire remember dream child account town.,2025-06-08
741,289,47,Level system keep market news in year tree.,2025-01-07
742,402,8,Than quickly finish respond total perform.,2025-10-22
743,204,15,Across religious rather back these little child around option learn.,2025-02-14
744,468,20,Want sound continue suffer series coach message become direction.,2025-09-12
745,400,28,Decision finish his relate activity today.,2025-01-21
746,334,4,Culture year rule agent network end.,2024-11-23
747,122,9,Issue tell interesting attorney need day similar situation discuss matter.,2024-12-05
748,122,20,Manage democratic resource list house Congress could.,2025-10-16
749,303,31,Attention how allow home authority improve leave support.,2025-07-19
750,7,1,Blood wind skill against wife without professor fire.,2024-11-20
751,215,42,Effect away drop international impact wait manager chance east.,2025-03-29
752,281,49,Peace side receive involve spring investment necessary health.,2025-07-20
753,43,36,Tell little at wall do account main time tough.,2025-07-27
754,483,14,International human work work control near final film available add.,2025-02-15
755,370,39,Dinner popular Congress on environmental drug.,2025-05-23
756,379,28,Age doctor particularly suffer spend million.,2025-10-18
757,16,9,Town church hair get represent common boy American write everything.,2025-04-18
758,311,5,Media kitchen ready possible eat soon station behavior black choose.,2025-07-07
759,116,26,Because result effort on enjoy development American admit.,2025-11-03
760,69,7,Power participant painting push response middle.,2025-02-15
761,240,23,Campaign measure difference bed process final around Mr.,2025-11-01
762,300,2,Relate analysis admit lot fund mother song half buy.,2025-06-24
763,387,49,Professor statement tough factor us.,2025-04-03
764,487,2,Pass impact citizen include court.,2025-02-17
765,254,26,Girl there culture reflect guess various song.,2025-10-10
766,469,14,Throughout land old medical tend everything officer.,2025-05-28
767,489,39,Source near hospital billion itself apply.,2025-05-29
768,264,43,Wide final heavy room ready age science tend kind fish.,2025-11-02
769,408,33,Science continue oil among friend impact outside.,2025-07-19
770,2,29,Teacher small activity thought bill never.,2025-07-23
771,453,10,Now several loss sell goal score win watch cultural.,2025-01-09
772,259,41,Have with consumer hundred past offer like.,2025-10-01
773,208,12,Citizen about summer study onto east usually.,2025-01-07
774,399,20,Need hot because pressure out important across entire what.,2025-04-20
775,402,26,Class model like drive call often heart although mind star any.,2025-06-18
776,329,26,How from few science free agency security star.,2025-06-16
777,8,23,Nothing education page task job may old place.,2025-10-31
778,59,1,Significant light run star couple.,2025-02-23
779,223,16,Eat little upon sing produce once professional will with such rather.,2025-11-09
780,281,48,Although force per memory.,2025-08-22
781,200,40,Anything let card much yeah onto kid.,2025-04-21
782,250,25,War why group increase give wrong.,2025-01-08
783,37,5,Five into study since your.,2024-12-15
784,120,17,Full citizen physical wear hear wife most government.,2025-02-03
785,289,30,Low long list all teacher learn other.,2025-06-18
786,384,50,Five prepare garden debate.,2024-11-25
787,166,37,Fall economy particularly middle leader use consumer design claim tax.,2025-10-29
788,200,37,Natural method admit popular college catch budget which memory factor recognize.,2025-02-25
789,22,16,Air raise involve life prove six.,2025-03-12
790,329,13,Guess player sometimes set present suddenly machine read relate great.,2025-02-08
791,490,32,Will people indeed foreign face wide she west air just.,2025-07-11
792,245,9,Morning enjoy morning figure interesting whole.,2025-06-29
793,174,14,On suggest this act friend easy increase southern.,2024-12-16
794,273,26,Now special nature analysis compare.,2025-06-05
795,373,15,Energy book head third no seek must human likely.,2025-05-27
796,438,42,Month own imagine through often American knowledge matter team environment.,2025-08-11
797,24,33,Call red art development scientist do customer issue response.,2025-04-11
798,447,23,Investment recognize government prepare stop after adult.,2025-05-27
799,282,8,Particularly around phone sense white travel business.,2024-11-30
800,232,34,Budget second in student right economic end reflect beat.,2025-09-13
801,149,44,Wait sister glass practice ago arm present cut.,2025-11-04
802,332,8,Situation attack my remember usually finish.,2025-06-10
803,210,8,Five last sing both price western without peace condition technology.,2025-10-24
804,140,43,Either because owner own national fly important culture.,2025-02-14
805,421,5,President improve follow history present marriage.,2025-05-07
806,212,29,Family technology visit shake run.,2025-10-13
807,147,16,Democrat present wear believe first argue idea experience address machine.,2025-06-09
808,195,4,Notice trouble reality week add agent wrong.,2025-08-26
809,387,40,Push air nature already after back listen than.,2024-11-23
810,102,4,Wrong building rise notice whatever recent again consumer reflect.,2024-12-26
811,292,43,Offer increase minute recently system away care.,2025-08-26
812,480,6,Environmental commercial always evidence business who letter will among show.,2025-06-09
813,67,41,Hair stuff husband protect fight.,2025-10-06
814,359,40,Candidate party produce answer senior her stage.,2025-04-14
815,61,15,Magazine prepare point write painting significant.,2024-12-11
816,310,5,Example certainly entire body economic unit.,2025-06-17
817,97,29,Simply citizen none or watch center add central go local.,2025-05-04
818,380,27,Science shake plant investment wear mother.,2025-03-31
819,349,7,Trade interesting raise want third hold employee.,2025-05-07
820,171,4,State half fly matter face interesting into leave church notice.,2025-02-02
821,469,20,Sound camera us career wait paper.,2025-09-02
822,250,37,Project once weight how goal.,2025-07-30
823,86,22,Some partner least religious kitchen data throw performance option.,2025-02-05
824,199,46,Hot hour book bag college feeling military attack hand five.,2025-03-17
825,458,19,Force follow campaign early.,2025-11-12
826,68,9,Kind bank beautiful individual pull among against focus smile question.,2025-09-26
827,85,7,Forward into sense young culture for try would.,2025-06-10
828,432,10,Common than trial month contain travel billion need yes.,2025-10-04
829,258,19,Outside little teacher computer community ready event side.,2024-12-04
830,398,40,Until better court yet any money artist could start.,2025-08-18
831,18,23,Small toward consider newspaper join however kid whatever stop.,2025-06-06
832,437,38,High store possible peace remember partner trip car marriage tell.,2025-11-01
833,29,25,Simple federal your which system town.,2025-07-03
834,302,26,Itself often base benefit bit head less research mission whose.,2024-11-29
835,372,31,Growth set talk simple note box camera they billion.,2024-12-10
836,250,39,Story improve behavior magazine no agent.,2025-08-02
837,376,27,Consumer international image size.,2025-07-05
838,63,16,Property education so either win a smile bag pull success firm.,2025-07-14
839,140,22,Summer trade poor after hundred yeah election impact add hard.,2025-04-23
840,150,45,Why season every where total.,2025-04-06
841,64,50,Report claim leave sound instead now role teacher reason father.,2025-02-17
842,60,10,Maintain event buy else beautiful item future state another.,2025-05-29
843,248,50,Myself seat poor care produce coach her.,2025-10-30
844,164,50,National personal cost large senior might develop alone nature society.,2024-12-05
845,168,2,Mrs paper herself hair political guy.,2025-08-26
846,312,4,Bill image off remain either technology at start.,2025-10-07
847,12,43,Just hear large yeah role.,2025-11-18
848,303,13,Sure beat not develop born you process short stand sound.,2025-10-27
849,303,25,Couple now somebody sport across tonight partner after wind.,2025-02-03
850,293,26,Could teacher perform former include investment.,2025-10-08
851,436,40,Least recently quickly audience middle watch.,2025-05-05
852,485,21,Quality consumer federal face ability card defense material area.,2025-08-06
853,465,30,Anyone arrive stay south husband event nearly necessary American away.,2025-05-20
854,257,30,Voice account position future south.,2025-07-08
855,401,24,Three stuff line peace future parent person.,2025-01-08
856,127,34,Quality party maintain society entire tree because heavy easy actually.,2025-02-20
857,370,35,Public college I news happen by his fill.,2025-02-12
858,398,45,Commercial station school him call act lot.,2025-03-20
859,399,16,Around seven attorney like will bank community result herself.,2025-10-07
860,209,7,Rule sure add another away trouble such.,2025-01-31
861,16,43,Management central military step standard cover clearly environmental everyone material affect.,2025-07-27
862,141,42,Foot collection area personal make church so base.,2025-03-02
863,284,41,Different will once head stage.,2025-11-11
864,259,29,Foot top their system particular next remember can.,2025-08-22
865,302,12,Put tend office positive finish environmental determine.,2024-12-04
866,256,44,Campaign summer product stand light.,2025-03-28
867,369,8,Very moment phone certainly assume.,2025-06-15
868,415,43,Plan born fill dog challenge point use your weight clearly.,2025-06-06
869,58,43,Notice meeting under between test year time science phone.,2025-10-22
870,404,41,Trade team picture some school near never.,2025-06-12
871,103,38,Imagine fact father audience have travel paper suffer agent group.,2025-07-01
872,442,25,Prevent discover let act forward second floor cover.,2025-10-31
873,320,39,Contain structure technology customer water how join century condition shoulder chance.,2025-09-11
874,302,43,Director senior sure top natural administration right.,2025-08-23
875,495,40,Decision investment case mind believe hot century.,2025-02-23
876,435,21,Action practice order pass student would we.,2025-10-16
877,471,31,Commercial leader but little control government key believe.,2025-06-24
878,469,15,Long Democrat guess choose.,2025-09-11
879,143,3,Floor training claim how question spring.,2025-06-19
880,41,43,Car star still table develop under glass note paper music.,2025-09-07
881,186,3,Hot life discuss decision.,2025-05-09
882,422,5,Office training staff style really unit strategy open skill.,2025-02-15
883,238,9,Traditional recent why father herself leader particularly own painting.,2025-04-09
884,323,31,Professional between big why employee.,2024-12-29
885,416,6,Note management address country organization measure way how page.,2025-04-25
886,29,13,Use answer Democrat exist security natural sing light car.,2025-05-10
887,478,7,Project kid blue plant measure.,2025-10-11
888,81,21,Prove current alone use pull seven.,2025-07-23
889,155,49,Theory enjoy discussion factor industry up almost expert north home former.,2024-11-29
890,390,24,For nation in section management onto world sea federal.,2025-06-09
891,364,50,Team national former law goal in consumer task walk.,2025-09-07
892,276,26,Family now kitchen people animal firm.,2025-09-04
893,148,27,Let common prove machine real.,2025-10-19
894,390,43,Then all several role style.,2025-01-24
895,355,6,Eat benefit event contain religious.,2025-10-16
896,98,11,Bad watch effect baby scientist who seat.,2024-12-12
897,239,48,Past statement treat everyone nature exist.,2025-06-03
898,349,31,Beat executive morning discuss wrong record see case keep never.,2025-03-01
899,207,30,Peace benefit responsibility professional only.,2024-11-28
900,418,41,Down however maintain pressure ground.,2025-04-13
901,304,5,Someone participant various Mrs hand herself.,2025-07-22
902,106,14,Short political baby measure house recently down fast hospital.,2025-07-18
903,29,9,Better follow consumer plant system moment consider.,2025-05-04
904,318,21,Ten sell candidate computer organization degree start vote hour light.,2025-10-20
905,90,46,Range yard room stuff technology various third ten me since.,2025-03-27
906,153,48,Plan nor picture box this discussion full next.,2025-05-03
907,72,25,Wall simply level impact finish report beautiful.,2024-12-06
908,250,9,Professor name challenge call.,2025-01-29
909,323,21,Suggest mention mother size fall stop.,2025-09-27
910,420,10,Sell right process again message create indicate now sometimes.,2024-11-24
911,25,26,Several skill write it hit while public sing off.,2024-12-19
912,204,15,Voice Mr board term surface create.,2024-12-07
913,94,7,Present result chair bed try toward college.,2025-01-29
914,2,13,Prevent dog someone under drop election accept support.,2025-02-11
915,328,35,Race other black miss forget mother wind.,2024-12-25
916,236,50,Information test success create daughter under move foot product point.,2025-08-22
917,60,22,Policy contain back brother here rule.,2025-01-30
918,499,38,Spend fine method teach wonder fill available another guess.,2025-04-20
919,490,44,Bit thing picture magazine black and son detail hope.,2024-12-04
920,4,12,Provide kid bill enter get blue speak what cover produce.,2025-08-03
921,69,12,Book arm little find analysis accept life.,2025-06-28
922,25,29,Despite forget everyone perhaps bring reveal window agreement worker edge.,2025-05-03
923,387,1,Despite police message author hear happy argue yard ready.,2025-08-22
924,175,50,Successful staff member bag two TV point baby wear.,2025-02-04
925,370,42,Eye phone building line move talk federal across offer water.,2025-04-14
926,397,29,Necessary far option admit policy often rest.,2025-01-31
927,74,34,Provide together past food look popular pick.,2025-05-31
928,78,13,Five main perhaps husband.,2025-08-25
929,319,16,Until party political wish decision response our.,2025-06-20
930,305,44,Interesting current dog strategy claim include.,2025-07-28
931,454,12,Factor chair risk finish look majority they yet two.,2025-11-14
932,197,50,Picture believe those president.,2024-12-25
933,221,3,Yourself interesting present listen get think its.,2025-04-23
934,321,47,Become around than last American.,2025-09-28
935,191,29,Hope to Democrat close behavior father.,2025-02-23
936,68,26,Return blue Republican late address cause few smile case.,2025-08-29
937,361,41,City treat tonight job international.,2025-01-11
938,32,26,His talk inside certainly able door same behavior.,2025-05-20
939,241,29,Painting service although director process seven site economy realize.,2025-07-14
940,325,38,About book point speech music capital skill free manage.,2025-05-18
941,275,40,Either material arrive reveal recognize focus carry test.,2025-08-09
942,30,48,First Republican fly unit receive even evidence.,2025-10-04
943,139,41,Change accept question successful age lawyer.,2025-11-11
944,165,14,Ground design reveal special back technology candidate action alone.,2025-04-15
945,317,14,Religious short change marriage the trip.,2025-05-28
946,157,30,Own reach discuss white than party have available.,2025-02-24
947,98,8,Save cover trial analysis maybe third.,2025-08-18
948,253,36,None vote high become service usually.,2025-06-26
949,176,16,Yes throughout financial form worker traditional order picture.,2025-06-16
950,308,18,Green them maybe drive south debate surface yeah size particularly.,2025-04-22
951,9,18,Prepare billion marriage people cost various outside scene focus skin.,2025-06-01
952,376,48,President meeting stuff wide will my.,2025-04-15
953,296,35,Information anyone together might hotel since.,2025-06-11
954,175,24,Value along education candidate herself.,2025-03-12
955,63,14,Hit answer tell history born election item sport commercial.,2025-07-24
956,313,23,Into population possible service of second a.,2025-04-08
957,101,50,Guess without behind be phone with else such order never.,2025-10-03
958,466,23,Message message might every toward break few born must discover.,2025-07-15
959,421,11,Five single economic station cost television education reflect out hand.,2025-07-09
960,416,3,News involve maintain front outside cut tend discuss cover traditional.,2025-06-11
961,388,2,Clear national he above feel whether.,2025-10-06
962,440,7,Green under want clearly defense large yourself note smile phone.,2025-08-06
963,436,5,State food experience act develop hand alone example.,2025-05-05
964,342,8,Night work nature explain dark administration everyone section guess.,2025-10-20
965,470,48,Attorney six deep throw nor eight concern however enough.,2025-08-25
966,375,44,We eight dog my husband event table candidate information.,2024-11-29
967,8,12,Summer history fear represent attorney road score capital lot not.,2025-07-03
968,86,42,Live ability set religious yard price paper hot.,2025-01-11
969,452,50,Less order somebody son assume.,2025-09-01
970,239,4,Hundred lot between during simply order write for at laugh.,2025-09-15
971,127,42,Return ground candidate necessary analysis modern.,2025-01-23
972,401,29,American any detail magazine door decision act stuff energy moment.,2025-08-13
973,451,1,Affect recent tonight win officer cell check group.,2025-06-15
974,136,8,Network girl performance know dog wife upon.,2024-12-05
975,234,21,Instead American write project wonder girl dog sell treat another.,2025-04-21
976,276,7,Ago different surface story employee environment order.,2025-09-05
977,131,23,Case beyond factor begin.,2025-10-06
978,320,24,Of hit if leg oil particularly step want about.,2025-05-12
979,406,8,Yeah media point wide loss use some well officer.,2025-06-11
980,312,40,Stage into responsibility pick hour artist adult election deep first.,2025-02-25
981,44,46,Hear into environment free why force not face form.,2025-07-07
982,347,47,Certain offer character network east.,2025-05-12
983,267,47,Always standard light trial few away bit such at agreement.,2025-10-12
984,111,48,Almost draw best huge return.,2025-05-21
985,110,43,Cause party American true particularly else moment resource house.,2025-06-26
986,215,16,Seem evening rest keep assume imagine third material knowledge trip.,2025-03-12
987,198,45,I news meeting sound pass lot.,2025-01-25
988,25,43,Plant whom tend painting would by cultural value number wonder moment.,2025-04-24
989,131,8,Wait Democrat voice thus everything husband law state production.,2025-03-10
990,108,9,Per hear because piece deal detail physical your.,2025-01-24
991,480,33,Financial defense sing there bill every movie often hear enjoy.,2025-05-04
992,390,49,Bag subject although total as hit despite.,2025-11-19
993,404,20,Member realize practice you many travel best.,2025-08-10
994,254,19,Left remember bar sometimes store.,2025-01-23
995,173,35,Property medical head success.,2025-04-13
996,469,11,Individual reason catch stuff election break pull away.,2024-12-27
997,320,37,Yeah around so knowledge especially challenge answer.,2025-05-29
998,452,24,Themselves production worry what control candidate respond.,2025-10-14
999,224,49,Call class far edge.,2025-07-10
1000,192,26,Color total discover drive film according involve law maintain itself.,2025-05-24
