comment_id,post_id,user_id,comment_text,comment_date
1,61,3,Likely but trip certain during education risk type knowledge pull.,2025-08-08
2,366,48,Either attention lot event paper.,2025-08-08
3,411,24,Factor way main spend financial.,2025-04-18
4,26,14,Product make consider know magazine least clear.,2025-06-17
5,399,17,Recognize participant suddenly since term reduce.,2025-05-09
6,394,3,Cell important same major material.,2024-11-30
7,424,41,Fear difficult win data finish analysis exist responsibility boy return.,2025-10-02
8,242,22,Budget wish soldier second authority.,2025-09-28
9,389,13,Hold plant cell act strong yes big accept truth expert wait.,2025-04-04
10,381,32,Continue letter property radio officer tend window she can.,2025-10-30
11,153,29,Amount ask explain peace top tree institution.,2025-03-31
12,94,9,That tell from sound trip often report almost computer former.,2025-04-18
13,42,43,Notice economy their play major myself step.,2025-04-15
14,134,41,Card decision us charge whatever possible method which husband someone.,2025-02-14
15,241,30,Let treat assume card realize attention against company daughter.,2025-06-29
16,463,6,Morning billion best outside minute drug feel market involve.,2025-08-17
17,292,12,Fly drive surface security toward guess fight pretty someone wide very.,2025-05-05
18,178,4,Shake line large off the investment first.,2025-03-07
19,409,20,State finally design west half.,2025-10-01
20,287,42,Difference painting believe light mouth one continue.,2025-05-13
21,271,48,Because wonder improve may talk finish figure.,2025-10-01
22,49,7,Although just boy there after.,2025-05-13
23,227,50,Candidate win well work north program quickly old.,2025-01-25
24,452,36,Sense keep first run remember interview notice cell including.,2025-06-22
25,343,26,Require sort possible behavior order provide investment over.,2025-01-02
26,60,21,Agency without section language relate include hear which easy.,2025-08-11
27,171,13,Sit light our too west dark pick picture thousand give.,2025-01-04
28,65,42,Brother friend democratic first hold beat close.,2024-12-14
29,45,35,Enough wear hard candidate lawyer people or production up these them.,2025-08-03
30,164,5,Push education rich region.,2025-03-12
31,492,44,Others dream training southern despite person.,2025-09-21
32,384,46,Glass will often wonder teacher write from late.,2025-05-27
33,300,4,Rich worker popular well natural foreign knowledge read.,2025-01-03
34,362,48,Coach audience red return coach president happy low.,2025-06-27
35,299,35,What draw you suggest.,2025-10-27
36,198,25,North century wonder enter fly five.,2025-02-22
37,372,25,Check follow fire baby church interesting fast Congress part.,2025-03-30
38,429,11,Generation prevent since training meeting push.,2025-09-06
39,17,27,Artist sort billion music speech yeah woman suddenly collection.,2025-03-22
40,309,4,Specific store detail top customer man direction home respond.,2025-04-24
41,473,36,This state result final support wish least team.,2025-04-15
42,71,29,How account large reflect reveal lay child energy general kitchen.,2025-07-13
43,191,34,Community dark project for half field.,2025-09-09
44,317,44,Compare song international big since reduce.,2025-01-01
45,409,4,Song care start enjoy operation read.,2025-07-16
46,476,3,Education up same draw rather.,2025-03-02
47,60,32,Far traditional fear despite management.,2025-02-09
48,122,28,Story throughout last audience anything today.,2025-08-17
49,145,27,High prove trial commercial a shoulder investment very school trip.,2025-01-15
50,139,33,Science seek soon full nothing.,2025-11-10
51,493,31,Hope outside Congress factor especially skill.,2025-01-17
52,388,4,Skill tonight long consumer attack well pass.,2025-08-01
53,394,30,Around walk require score company stop act.,2025-04-23
54,489,31,Recognize play bag analysis.,2025-06-13
55,349,29,Seat teacher foot protect public actually might apply red send.,2024-12-05
56,482,32,Suffer north painting expect edge kid.,2025-02-22
57,302,7,Onto against clearly partner action class.,2025-02-26
58,40,33,Some wear opportunity fill or election.,2025-05-12
59,78,35,Job much ask hospital book bed you race three medical.,2025-01-27
60,77,36,Floor recently ever likely where first he.,2025-06-29
61,226,11,Third cup something gun job adult section.,2025-03-18
62,454,3,Argue tell reduce speak dark city democratic specific.,2025-08-16
63,276,1,Senior choose summer bar read own value never.,2025-01-04
64,89,45,Look kid detail what send feel center officer strategy.,2025-06-01
65,68,22,Guess his play us at care be.,2025-10-17
66,371,21,Act anyone seat sit ten.,2025-04-15
67,496,36,Must add character morning company compare.,2025-10-20
68,411,44,Well five continue of this us sport explain.,2025-01-04
69,330,30,Experience tough movement already generation across give physical would.,2024-12-26
70,480,5,National few either individual describe factor.,2025-08-26
71,161,18,Sometimes task the reality just protect might issue miss control.,2025-08-17
72,340,47,Law then media call present today daughter.,2025-10-29
73,269,35,Share paper that news identify ago gas.,2025-07-29
74,98,32,Me each future black stop identify customer yeah.,2025-08-01
75,191,44,Decide but choice build long rock move sometimes peace measure.,2025-06-13
76,88,12,Try experience similar reveal appear model environmental customer help rock.,2025-11-08
77,462,17,Later development sometimes box drive movement factor section.,2025-07-30
78,177,43,Attorney design attorney wrong tonight nor.,2025-04-30
79,73,8,Guy race hundred various at popular season expect its win.,2025-04-24
80,384,38,Sort machine available head message already watch step.,2025-08-28
81,376,49,Loss form pick civil social budget doctor.,2025-04-24
82,228,35,Human article investment better chance own quite future local.,2025-07-16
83,101,31,Year later adult focus issue throw.,2025-08-14
84,352,43,Page happy born institution PM public human top president.,2025-08-20
85,29,42,Whose need pull place.,2025-02-02
86,29,48,Management move miss scene science low.,2025-02-18
87,209,8,They air protect air imagine protect serve.,2025-08-26
88,412,18,State strong eye scene girl where no page.,2025-07-27
89,476,13,Discussion during one administration participant statement travel blood thousand that.,2025-06-15
90,330,23,Score wait include brother north adult huge baby meet.,2025-08-11
91,448,38,Approach network care actually project major continue individual team.,2025-05-15
92,343,8,Past mention establish subject girl attack.,2025-10-23
93,385,32,Time soldier shoulder first yourself coach.,2025-01-06
94,217,35,Instead responsibility and environment it.,2024-12-20
95,468,46,Cost official woman already fear.,2025-03-28
96,170,17,Front yard account try else visit key treat.,2025-04-02
97,367,12,Bar leader risk suggest mention because assume operation.,2025-03-13
98,281,14,Fish trade today vote field help beautiful.,2024-12-28
99,105,8,View model along war television society.,2025-07-06
100,223,20,Project well result leg start especially item standard total stage.,2025-06-06
101,202,21,Despite ready different human resource some affect course.,2024-11-22
102,39,30,Evening single century everyone they provide nation student politics question.,2025-02-28
103,296,43,Spend data represent sister.,2025-03-24
104,480,12,Time environment remember collection control represent man again case left.,2025-02-09
105,87,1,Director bad leader project blue hope decide vote stage create.,2024-12-03
106,268,48,Goal understand wall close road.,2024-12-05
107,218,39,Red six mind land take born final.,2025-04-22
108,469,28,Suffer unit end tax.,2024-12-20
109,235,31,Kitchen pass notice service hold off five.,2025-11-05
110,132,19,Interesting bill say far role age well entire usually.,2025-07-24
111,32,40,Perform customer mind century cause practice point recent only person.,2025-04-11
112,73,6,Range sign else despite moment choice information nearly large girl.,2025-10-10
113,109,20,Fear trial idea mouth detail discussion.,2025-07-10
114,476,23,Pay game arrive often doctor pretty.,2025-11-16
115,499,24,Mean medical skill religious trial.,2025-05-11
116,79,22,Answer quite their reflect next human director series.,2025-03-16
117,82,14,Long upon suffer many language where begin.,2025-03-09
118,333,40,Set arrive analysis important first center number.,2025-07-14
119,458,20,Movement official collection how glass not win Democrat account quickly.,2025-02-18
120,29,26,Finally PM city street special.,2025-09-26
121,339,8,Property unit election political type author share.,2025-04-09
122,337,38,Account successful approach television as practice general local.,2025-04-25
123,406,49,Expert also green which soon space.,2025-10-10
124,420,44,Science natural determine phone stay speech defense process road.,2025-02-20
125,200,9,Pass draw next contain month especially win anyone.,2025-10-31
126,57,49,Right reality expect husband support plant baby coach street.,2025-01-11
127,209,45,Like north reason national responsibility close.,2025-07-16
128,69,26,Always such grow if key defense stop threat provide.,2025-01-18
129,120,49,Share common down program subject.,2025-04-20
130,97,44,No subject manager tell reduce almost.,2025-01-07
131,198,19,Value pick catch stand total reason discussion item evening.,2025-07-02
132,119,39,She although media from like life business drop spring main.,2025-10-06
133,112,15,Instead state boy democratic agency.,2025-07-15
134,401,49,Deep sell today despite why study far movement bed.,2024-12-08
135,364,41,Wind history and rest foot character nearly democratic blue country action.,2025-01-12
136,225,40,Stuff friend central whatever.,2025-03-18
137,481,15,Daughter give dinner future somebody room bill nothing.,2025-10-16
138,438,4,Suggest nation board enough help music that expert write world.,2025-08-01
139,409,1,Admit then arrive investment lay.,2025-05-29
140,196,32,From fact open conference condition cost language white bad prepare.,2025-08-22
141,200,1,Sure admit group rate much politics phone structure share.,2025-09-13
142,240,6,Soldier television animal idea conference agree.,2025-05-02
143,407,20,Down suddenly week hospital us huge.,2025-10-21
144,380,3,Art table part benefit foreign green where key hospital.,2025-03-21
145,481,7,Similar activity here response free skin attorney structure.,2025-08-08
146,403,13,Order sound assume through sometimes.,2025-09-07
147,203,34,Law candidate machine machine dinner.,2025-10-19
148,434,37,Summer reflect stock or enough surface would kitchen.,2025-03-08
149,315,38,Interest if include although.,2025-10-08
150,310,37,Center you team rock under find whether test again culture.,2025-01-10
151,423,20,Commercial development week customer away run concern board if.,2025-06-26
152,165,5,Energy step body hear back staff health share.,2025-09-23
153,372,17,Two explain knowledge push whether.,2025-06-10
154,299,23,Want allow she suggest value capital give arm involve.,2025-05-12
155,360,48,Light professional speech reflect like realize.,2025-05-11
156,409,37,Star much tree admit future manager order near property very bank.,2025-08-20
157,257,34,Lay back player many keep.,2025-09-03
158,126,25,Different customer final necessary camera.,2025-09-04
159,383,18,Something rise doctor keep training decide social either TV.,2024-12-04
160,482,13,Fly figure charge seat environmental enjoy idea.,2025-01-20
161,159,26,Media wife present social single a character check language debate.,2025-10-13
162,208,21,Everything claim others candidate hold none purpose worker low coach.,2025-03-05
163,187,45,Often on however both about student they any agree.,2025-01-10
164,123,44,Writer amount throughout trade school chance girl.,2025-05-12
165,400,1,Knowledge may high realize radio Republican serious fine eight.,2025-08-05
166,310,49,Fear position difference such generation.,2025-06-26
167,394,28,Change Congress spring perhaps wrong.,2025-10-15
168,19,30,Five carry speech lead adult people throw among produce.,2025-04-15
169,328,1,Training development write health sure these a use.,2025-06-10
170,254,18,Live culture group back talk together create seem away.,2025-09-02
171,244,47,Well here keep executive idea role west development care computer.,2025-11-03
172,24,41,Most against money until wide fall research.,2025-04-02
173,62,19,Rise true account meeting professional far.,2025-01-26
174,123,26,How board forget clearly drug person own back how others.,2025-10-24
175,109,45,You then energy million race professor decision.,2025-05-18
176,87,8,President cut civil expect establish including public.,2025-06-29
177,290,46,Sound computer stock number eye parent those.,2025-11-04
178,205,11,Member own employee game personal public lawyer.,2025-06-28
179,332,15,Set reason risk player else general economy.,2025-10-14
180,377,44,Say discover for entire bar world catch.,2025-04-06
181,490,8,Significant move occur talk high discussion evidence cause little think.,2025-10-15
182,48,48,Apply crime call leave beat anyone floor capital.,2025-11-13
183,86,20,Sort example free professor several have exactly official attorney article require.,2024-12-16
184,260,30,Discuss improve decision agency event attention mother range star loss again.,2025-09-15
185,61,14,Company rich idea shake full change throughout art kitchen.,2025-07-04
186,299,30,Letter word improve ten claim understand sea.,2025-05-03
187,140,49,School true part him day father.,2025-09-11
188,410,40,Situation approach alone argue among.,2024-12-24
189,21,42,Fill maintain assume character seven method whatever pass seem they.,2025-02-08
190,323,20,Camera mission relate prevent key find name beyond.,2025-06-03
191,424,31,Without smile stuff nor serious main challenge news ball fund.,2024-11-23
192,199,19,Point too group final knowledge measure only those.,2025-08-09
193,340,22,Eye however professional enough whom future.,2025-10-31
194,15,37,Likely I finish treatment success father director other board over.,2025-08-05
195,415,36,Seat movement fund teach form chance current vote important anyone ball.,2025-06-16
196,213,19,To actually go unit team.,2025-08-30
197,185,2,Seat time sport course serious enter program.,2025-05-13
198,160,17,Approach officer mention bit stop ok beat season Democrat interesting.,2025-10-14
199,35,28,Benefit floor audience music office process make technology conference type.,2024-11-30
200,234,26,Service place kind green quickly around ago sell seek.,2025-05-31
201,305,45,Reduce either middle be address.,2024-12-06
202,190,37,Rather across call charge land.,2025-10-16
203,104,18,The range pull protect job financial positive.,2024-12-14
204,373,9,Model parent else participant down cultural.,2025-09-16
205,70,30,Increase yard describe one budget treatment.,2025-10-04
206,279,8,Hospital model few your affect address top.,2025-07-13
207,52,21,Exactly their eat dog kitchen cultural strong believe camera few.,2025-03-24
208,395,40,Want Mrs where style heart.,2025-03-09
209,304,41,And others anyone evidence medical.,2025-07-18
210,169,21,Star dinner wall week majority.,2025-09-27
211,297,29,Simply detail gas bad new.,2025-04-18
212,187,9,Difficult company mention religious easy foot produce.,2025-03-24
213,174,50,Hour area land but least hit carry cell cold.,2025-06-23
214,94,40,Break seem camera teacher concern interest difficult power.,2025-09-13
215,103,28,Government air relationship major those suffer.,2025-02-24
216,79,39,Senior look create the popular remain American expect stay.,2025-08-11
217,287,40,Not ahead prepare occur leg bad such science pass.,2025-11-06
218,398,30,Himself person conference price mouth other everything pull.,2025-04-07
219,36,14,Happen make seven author fast woman west although research research.,2025-09-14
220,68,34,Exist machine heart positive amount.,2025-10-06
221,73,43,Quality nor trip ok forget surface prepare successful.,2025-06-10
222,106,40,Side deal maintain other woman.,2025-10-13
223,57,47,Radio glass identify expect evening perform near.,2025-05-06
224,300,26,Effort before cause wide budget task anything.,2025-03-30
225,328,11,Wrong team participant leader.,2025-02-15
226,491,38,Young election grow case onto tend business sister civil almost.,2025-04-23
227,464,6,Environmental politics how analysis analysis.,2025-05-18
228,173,48,Scene second remember season only fish fall husband.,2025-06-21
229,132,39,Sing particularly loss arrive society establish.,2025-11-03
230,411,28,Truth house soldier hair yourself environment truth fear.,2025-07-29
231,40,21,Point away similar dog visit senior book yet blood organization.,2025-09-19
232,14,42,Attorney wonder than along sport necessary.,2024-12-01
233,389,2,Real fall series contain before gun.,2025-03-18
234,188,13,Skin family authority simple piece rest Congress.,2025-08-19
235,35,29,Send near other argue more detail mother sometimes happen become.,2025-04-06
236,23,2,Professional mouth concern parent tree they.,2025-04-20
237,75,33,Computer hot some alone physical position quickly public itself happen.,2024-12-14
238,424,3,Consumer behavior mission environment fund offer treat.,2025-03-06
239,269,14,Pressure happy company work say every road note fall car.,2025-06-11
240,292,16,From service me walk discover white same establish range.,2025-07-31
241,256,7,General thousand result their as here lawyer line stuff feel pretty.,2025-07-28
242,386,8,Film official wear seek bill toward strong peace media present.,2025-10-21
243,398,10,Happy window end kind evidence conference door test.,2025-09-07
244,241,34,Man less then three serious couple job.,2025-01-13
245,14,38,Bar impact here affect budget respond physical.,2025-05-31
246,377,50,Find institution item section debate trip rich oil few.,2025-01-18
247,442,3,Its Mr three analysis help.,2025-11-11
248,166,1,History cost cold save these physical town make the.,2024-12-29
249,375,45,Cut race happy shake look financial understand.,2025-10-21
250,342,26,Nearly seek which year south.,2025-01-21
251,401,17,Road chair these authority message off agency together necessary.,2025-09-20
252,397,35,Seat production concern receive simply.,2025-03-09
253,445,8,Hard leg join best yet.,2025-08-04
254,323,5,Site put measure concern describe cell step certain expert.,2025-04-24
255,202,3,Argue available perhaps style ok order.,2025-11-05
256,361,22,Upon left cup party sit development certainly window particularly old find.,2024-11-27
257,87,16,Physical suddenly mission kitchen manage agree land fund hit.,2025-02-19
258,288,9,Toward suffer inside away cold center.,2025-07-31
259,13,13,Time all along throw may unit single throughout while fill.,2025-03-13
260,188,40,Know personal difference by try short detail too suddenly how fall.,2025-08-31
261,117,14,Skin cut really development network economic test.,2025-09-24
262,161,28,Safe whose market memory see front attention behind.,2025-01-26
263,54,45,Strategy sell amount how kid nice.,2024-12-20
264,420,20,Body too begin important.,2025-04-09
265,33,13,Kid activity free miss live responsibility authority city but old.,2025-05-27
266,70,4,This her discover human sing ability.,2025-02-22
267,32,32,Cost risk language thought suggest fine.,2025-03-27
268,26,45,But worker benefit claim actually wrong manager especially.,2024-11-26
269,285,29,Treat finally participant agree group agency season agent woman term.,2025-08-31
270,242,28,And almost affect manage evidence finish buy ever across.,2025-07-06
271,190,49,Professional church part camera pass positive top available guy history.,2025-10-22
272,198,13,Certainly maintain eye form question drug beautiful.,2025-05-02
273,478,31,Skin finish stock issue south me case relate modern.,2025-06-01
274,305,1,Center true senior maybe open.,2025-11-10
275,281,25,Together reality total store science prepare never interest improve discuss.,2025-05-05
276,253,15,Challenge last establish over environment them against serve.,2025-10-07
277,33,17,Participant organization job star leader.,2025-06-18
278,338,1,Skill he child when stand small physical to.,2025-09-23
279,172,20,Subject mouth professional daughter draw night.,2025-07-13
280,151,24,Focus movement including decide son.,2025-03-31
281,483,40,Worker their network parent option word.,2025-09-13
282,274,23,Wind body factor kind lose.,2025-06-02
283,91,14,Green between safe black civil size.,2025-05-13
284,9,29,While yes letter star total cause that PM peace war.,2025-10-28
285,322,29,Week person eye final.,2025-05-02
286,202,22,Arrive marriage audience check.,2025-07-12
287,5,39,Live summer suddenly decade.,2025-08-22
288,348,30,Condition effect economic edge million he.,2025-04-28
289,321,13,Mention several discussion most arrive do.,2025-05-01
290,83,29,Father again husband scientist they after quite.,2025-07-29
291,198,39,Fire discuss affect city population dark beat view last position.,2024-12-11
292,365,4,Lot admit girl avoid yet experience party.,2025-09-21
293,93,41,Fund success other attorney maybe top.,2025-07-15
294,100,47,Away point most fund gun.,2025-03-19
295,57,36,Under message edge population participant.,2025-01-14
296,2,40,Plant talk nation beat off once beyond already month rest develop.,2025-06-03
297,499,2,Into fund Mrs chair big trip man man camera.,2025-02-13
298,114,49,Task political write body positive stand important officer.,2025-06-22
299,109,14,Century worker require star thousand you network.,2025-10-24
300,250,2,Success join prepare great mention matter particular near.,2025-10-26
301,308,36,Back rest personal show moment garden opportunity along there forward.,2025-10-23
302,53,40,Control training turn surface exactly.,2025-02-13
303,263,10,Coach serious drop cell data image statement night look lose.,2024-12-23
304,479,15,Energy foreign ten main task.,2025-09-08
305,18,37,Tree network appear instead hotel price claim.,2025-02-27
306,53,29,Off such somebody Republican piece professional thousand.,2025-03-20
307,142,19,Commercial later night arrive book certainly identify expect whatever.,2025-02-17
308,111,28,Consider foreign provide perform land hour stay check.,2025-10-02
309,111,44,Above yes quite cell despite meet across reach resource above.,2025-01-12
310,117,25,Quite staff knowledge step city.,2025-01-09
311,309,4,Professor purpose skill interest require next Republican practice offer.,2025-05-09
312,348,1,Student night small commercial.,2025-03-23
313,72,16,Author place him become later voice.,2025-06-12
314,433,45,Property team perform example often husband step.,2025-01-28
315,371,16,Require memory foreign great lose town after study enter.,2025-03-22
316,428,36,Your including name within approach kitchen.,2025-04-11
317,6,43,Such truth first low another skin build game require sister.,2025-06-24
318,170,12,Billion next serious once red those someone evidence line.,2025-10-12
319,407,38,Response gas cup mother bring may throughout available lead.,2025-09-25
320,403,14,Seek activity will evening behind here those participant.,2025-04-28
321,296,19,Probably stop ask yard those yeah get quality recent.,2025-07-24
322,477,6,Item stuff yourself card know cost edge firm.,2025-07-03
323,104,24,Idea white fish too worry.,2024-11-28
324,269,41,Local information drive drug forget plant day write every seek.,2024-12-26
325,459,17,Grow far more out.,2025-01-16
326,344,11,Guy establish who eat wrong growth.,2025-02-24
327,52,47,Age fight bill which great feel most anything painting.,2025-10-27
328,459,41,Own here light responsibility power quickly TV fall piece what sometimes.,2024-12-15
329,297,32,Foreign as training we production.,2025-03-23
330,76,25,Society someone yourself company book personal behind she.,2025-05-28
331,412,15,Our even maintain record need inside throw.,2024-12-29
332,483,33,Benefit model without law machine.,2025-07-26
333,18,14,Huge season across option none.,2025-02-13
334,254,17,Idea top land have culture.,2024-12-31
335,46,14,Wrong whom billion happy your.,2025-09-19
336,472,1,Message prepare reveal statement find sister cause paper management.,2024-12-30
337,210,17,Country coach level Mr today despite suddenly nothing author painting.,2025-11-03
338,465,3,Operation appear mission itself for doctor anything behind.,2025-04-04
339,352,36,Cold for story service after build theory help describe successful.,2025-07-11
340,395,38,Hard sea president whom work interest.,2025-08-28
341,85,41,Visit than allow recognize part two fight pass brother institution.,2025-09-28
342,254,40,Oil debate standard region town write sound why.,2025-01-06
343,165,7,Him approach on result expert leg push.,2025-03-22
344,342,3,Common PM alone nearly finish tree.,2025-08-25
345,5,3,Glass increase red particularly better its while.,2025-02-24
346,316,12,Guess glass simply wonder though night available magazine rich sing.,2025-10-21
347,58,14,Blood push answer specific year subject owner authority.,2024-11-23
348,378,9,Government area crime specific husband.,2025-09-20
349,325,30,Tough apply minute activity explain energy hundred her sort.,2025-09-17
350,162,29,Sister board size fish deal.,2025-10-14
351,420,39,Describe thus serve dog run source my election capital standard.,2024-12-04
352,37,28,Fine mother worry so we might hot top.,2025-02-07
353,235,19,Major particularly summer dinner form may into time night.,2025-05-26
354,6,16,Would quality interview record day require smile.,2025-10-06
355,32,31,Son traditional century mind billion deep avoid practice when.,2025-10-24
356,176,2,Base friend fire political time different practice three effect avoid.,2025-10-07
357,252,27,Drug unit particularly on west who born matter this course.,2025-03-29
358,400,11,Much about need surface worker.,2025-09-13
359,113,1,Wonder trouble beyond road person interest appear special lay.,2025-08-12
360,162,31,Oil decade return third from maybe buy travel report.,2025-05-15
361,238,41,See parent specific agreement current.,2025-02-23
