post_id,user_id,post_date,content
483,7,2025-01-14,Trade unit rich lose production.
484,18,2025-08-18,Affect think detail her old.
485,9,2025-05-23,Ground decade hold.
486,3,2025-02-23,Series central despite life old.
487,19,2025-01-20,Dog see few.
488,18,2025-10-12,To election carry American recognize.
489,22,2025-05-10,History individual newspaper.
490,3,2025-09-30,Radio paper ahead sort car miss from.
491,16,2025-03-08,Just radio democratic officer cover care.
492,16,2025-02-25,Push gas direction dark value help issue pass.
493,20,2025-05-20,Generation summer bad protect cause.
494,28,2024-12-13,Staff network some only miss with.
495,29,2025-01-11,Impact example education prevent after.
496,41,2025-02-14,Part people fund thousand produce second reason whole.
497,1,2025-05-16,Hotel debate your audience possible really.
498,43,2025-10-01,Each yourself same among section start.
499,7,2024-11-29,Early at treat night sign receive beautiful.
500,36,2025-09-12,Speak point series sister green my several.
