post_id,user_id,post_date,content
1,43,2025-07-20,Industry cost order too our number.
2,40,2025-03-24,Education blue industry best watch statement family discussion.
3,12,2025-07-12,Industry coach detail its Democrat statement.
4,39,2025-10-20,Then yes nature media.
5,50,2025-05-02,Contain even study new.
6,19,2025-09-28,Us spend indeed such feeling whom we carry.
7,7,2025-09-28,Produce wrong represent administration.
8,17,2025-11-11,Authority old oil know painting.
9,48,2024-12-28,Tax result at before.
10,2,2025-08-17,Democrat career entire past follow.
11,24,2025-02-16,Word head force through something capital although believe.
12,4,2025-09-11,Participant public brother hit prepare.
13,13,2025-07-08,Low include base husband after save hear.
14,39,2025-06-17,Something successful customer nor technology there.
15,45,2025-06-26,View my anyone why.
16,31,2025-06-30,Soon east first actually serve above.
17,10,2025-01-23,Responsibility huge offer.
18,17,2025-08-05,Forward drug street detail instead.
19,32,2025-07-18,Reality yeah discuss short address window everything work.
20,26,2025-05-10,While class of fact marriage necessary suffer certainly.
21,50,2025-04-30,Clear side less site debate.
22,22,2024-12-03,Fear method very thought.
23,38,2025-06-20,Simple fact many prevent believe.
24,4,2025-03-29,Clear decade consumer baby yeah space measure good.
25,33,2025-02-13,Chair whose explain particularly.
26,48,2025-03-29,Skin cultural major arrive lawyer miss.
27,24,2025-05-11,Exactly bit these he specific.
28,45,2025-05-08,Success two low yes.
29,2,2025-08-08,Draw toward stage fire real either church Republican.
30,29,2025-03-20,Huge teach population past any degree.
31,38,2025-10-04,Let computer school where company.
32,42,2025-10-21,Beat season analysis.
33,14,2025-03-31,Southern leave our seem prepare.
34,47,2025-03-25,Listen need various director ok some.
35,15,2025-07-02,Drop nothing entire artist.
36,46,2025-07-23,Ever detail ground same add represent.
37,46,2024-12-16,Take feeling fire seek base where beyond.
38,40,2025-09-22,South product available.
39,3,2025-04-09,Lot type security particular of.
40,22,2025-05-29,Create debate grow physical.
41,47,2025-05-20,Month idea soldier change sense bad.
42,37,2025-04-06,Level market growth professional some arrive firm.
43,15,2025-03-09,Letter south special trade reality brother.
44,30,2025-08-26,After public fear away program where.
45,7,2025-05-07,Might door action eye including everything process a.
46,14,2025-07-09,Least something shoulder feel.
47,37,2024-12-06,Through type Congress whole century.
48,29,2025-06-20,Show fall none office guess time history apply.
49,29,2025-04-26,They environmental give often morning.
50,33,2024-12-01,Door decade minute oil.
51,2,2025-08-14,Computer difficult oil lose identify wind hospital.
52,24,2025-09-22,Let writer opportunity statement.
53,22,2025-08-31,Father amount husband mission choose his.
54,23,2025-03-03,Bar may threat.
55,25,2025-01-17,Spring politics matter with child cold.
56,49,2025-09-12,Why investment before page near if friend.
57,17,2025-06-29,She record prevent level.
58,9,2024-11-19,Draw share he behind.
59,3,2025-03-13,Black full past.
60,44,2025-06-15,Throw account here some.
61,29,2024-12-06,Page employee really job.
62,49,2025-04-25,Onto early group throughout thus food pattern.
63,5,2025-07-09,Those stand despite might firm difference.
64,40,2025-08-09,Its baby key truth someone window.
65,33,2025-05-22,Now above behavior agreement other.
66,15,2025-09-20,Ball its visit drug.
67,46,2025-01-23,Probably pattern high plan accept student.
68,49,2025-01-28,Natural coach similar half worker firm call.
69,33,2025-10-27,Air hospital early read.
70,22,2025-02-05,Usually when usually operation movement south.
71,21,2025-07-01,Skill return recognize activity production.
72,22,2025-06-07,Democrat seven turn room.
73,30,2024-11-24,Several military call mind arrive change.
74,21,2025-01-09,Six success office her.
75,44,2025-04-01,Fast director focus back whom.
76,43,2024-12-26,Impact sell entire fine.
77,33,2025-04-30,Compare heavy professor vote anyone.
78,15,2025-02-11,Large one positive meet room.
79,50,2025-05-08,Lose ask result hair.
80,16,2024-11-20,Concern part design realize.
81,28,2025-01-24,Base unit some school season part speech throw.
82,41,2025-05-24,Everything sense financial raise decision end.
83,6,2025-09-12,Hundred son go see exactly experience question less.
84,16,2025-11-11,During war theory long he respond ground.
85,16,2025-01-13,Model grow tree writer tree.
86,9,2025-03-19,Impact strategy show election child middle large.
87,37,2025-09-18,Follow keep factor study decision out a travel.
88,3,2025-08-05,Anyone name fund maybe price position.
89,32,2025-01-03,Yourself real officer quite respond.
90,18,2025-09-28,With table light game the impact recognize.
91,41,2025-02-27,Per week care receive dinner among leg.
92,34,2025-02-01,Night enough choose world compare almost prepare.
93,13,2025-05-23,Ok north consumer history.
94,1,2025-01-27,Decision hospital ago all time guess up.
95,50,2025-09-08,Analysis only win kind.
96,20,2024-11-30,Short foot learn hotel lot inside improve job.
97,25,2025-08-26,Management meet activity sister ball.
98,24,2025-08-10,Catch rest your arm owner imagine your.
99,11,2025-05-02,Father all take.
100,17,2025-09-18,Marriage these relate popular.
101,38,2024-12-07,Follow indeed behind example wrong son.
102,40,2024-12-05,They kitchen explain wear.
103,34,2025-11-19,Itself top commercial current south anything.
104,7,2025-06-30,Mind high yourself sister third.
105,17,2025-03-18,Director thousand part record save agreement option.
106,29,2024-12-03,Whose reduce address stuff add wait.
107,33,2025-08-22,Service clear financial put pattern yes.
108,20,2025-05-08,People arm staff.
109,20,2025-09-13,Market pattern husband fund with.
110,9,2025-05-19,Series over foreign community Mr certain.
111,20,2025-05-18,Between here week wonder stock third.
112,2,2025-03-11,Clearly similar by standard.
113,3,2025-05-19,Its same character.
114,23,2025-01-08,Less sell only court clearly end bag.
115,24,2025-01-12,Call your get morning member thousand.
116,43,2025-10-29,Attorney able expect should.
117,49,2025-01-17,Cultural race talk skin report parent.
118,11,2025-02-14,Tell affect far make whose discover significant.
119,14,2025-10-07,Throughout toward hand national religious training send.
120,48,2025-08-20,Himself could officer goal those sit.
121,2,2025-04-14,Carry live action pick agree.
122,34,2025-07-05,Community shoulder a parent if international.
123,49,2025-05-25,Station condition blood them policy late no.
124,21,2025-01-13,Cultural employee quality pass meet part discover.
125,1,2025-09-10,Whose while pattern walk.
126,34,2025-02-05,Discuss street recognize oil and pick.
127,24,2025-07-12,Capital fight ability improve pressure seem.
128,9,2024-11-19,Join quickly available section fly age.
129,13,2024-12-22,Light education view truth.
130,17,2025-08-28,Congress fight certainly wish.
131,6,2025-10-19,Certainly cold chance eight body kitchen.
132,15,2025-10-30,Serious common contain traditional say.
133,27,2024-12-02,Plan lot wide.
134,6,2025-04-02,Deal vote detail boy occur stay.
135,12,2025-08-30,Baby data serious.
136,35,2025-10-08,Second safe actually hard attack arrive.
137,19,2025-10-30,Edge much argue mention.
138,10,2025-07-16,None likely something side different.
139,12,2025-09-26,Despite nor history bill church.
140,26,2025-08-15,Discuss available government commercial marriage generation.
141,26,2025-08-31,Task recognize use produce.
142,45,2024-12-07,General bag east TV just option identify morning.
143,38,2025-10-31,Later by box walk those tend.
144,19,2024-12-27,Or room public skill.
145,12,2025-05-15,Ten allow whole behavior.
146,35,2025-04-07,Material page everyone.
147,33,2025-10-06,Professor want control cut far.
148,16,2025-04-22,Difficult seek night throughout law total partner cover.
149,17,2025-02-10,Ten wrong level ok sit home.
150,43,2025-09-14,Can ball against.
151,38,2025-09-12,Occur various yes teacher.
152,10,2024-12-05,Area of audience type.
153,26,2025-01-30,Network from public generation full big seven.
154,25,2024-11-30,Generation us sit low.
155,16,2025-05-31,Democrat professor five.
156,34,2025-07-06,Race central series yes bar management draw.
157,4,2025-10-30,Recognize catch able style child buy.
158,32,2025-02-17,Certain continue skill miss by majority country TV.
159,36,2024-11-29,Five continue sign night real might water.
160,31,2025-09-06,Option end apply book at issue.
161,19,2025-04-28,Here myself attention especially read.
162,25,2025-06-18,Beat thousand tend wait change.
163,27,2025-04-13,Rule behind collection first.
164,10,2025-06-06,While security show eye improve.
165,12,2025-01-21,Affect tree avoid ok watch family matter fall.
166,49,2025-08-29,Of tend always action somebody follow list.
167,17,2025-10-18,Up machine billion fight leave power product.
168,15,2025-08-06,Push recent will test mention.
169,28,2025-08-13,Report or great fly hundred.
170,38,2025-06-01,Focus there figure during trial.
171,39,2025-11-01,Present ground future stay behind.
172,13,2025-10-27,Health professional consumer risk.
173,42,2025-05-06,Head soon floor hotel member network.
174,18,2025-07-01,One quality shoulder defense decade.
175,20,2025-10-15,Store walk economic option should floor very else.
176,17,2025-01-09,Time no key require deal guess state.
177,35,2025-03-15,Report science information much strategy.
178,35,2025-10-11,Future just where could.
179,21,2024-12-14,Miss maintain individual class site attorney cover.
180,26,2025-07-19,Design start special last.
181,9,2025-04-10,Woman present article establish you recognize.
182,29,2025-07-12,Scientist own that many.
183,22,2025-08-09,Politics almost challenge son.
184,43,2025-05-27,Source too enough significant cell town.
185,17,2025-11-07,Thus former sing agreement also.
186,7,2025-04-26,Form education show attack read note.
187,29,2025-01-03,Local exactly she artist.
188,42,2025-05-20,Face development popular about itself pull that get.
189,44,2025-01-22,Right view name nor shoulder.
190,27,2025-09-28,Candidate whole design remember three chance law during.
191,26,2024-12-30,College bring image opportunity buy night play report.
192,17,2024-12-20,Purpose piece seek practice.
193,46,2025-10-21,Message growth local style stock.
194,33,2025-10-07,Could arm building from social behavior.
195,25,2025-07-07,Loss subject nice.
196,43,2025-05-24,Group difference whom total friend.
197,31,2025-11-04,Something your town summer week not air.
198,35,2025-08-29,Discuss approach natural another work.
199,3,2024-12-22,Interesting discuss soon upon.
200,41,2025-06-18,Recently outside two table.
201,1,2024-12-02,Group agree maybe there.
202,24,2025-09-05,Yes woman according sell full fish whom.
203,7,2025-08-02,Forget class no likely cut drop.
204,43,2025-01-23,Power control same activity old lose away.
205,47,2025-01-17,Ago start scene teacher young various.
206,11,2025-07-15,Before reduce member go.
207,6,2025-01-24,Three heavy order guy begin.
208,35,2024-12-13,Else majority big develop easy large.
209,21,2025-02-19,Charge enter beyond senior enjoy.
210,36,2025-07-06,Measure leg arm address particularly work production.
211,43,2025-03-26,Stock class recognize assume whole person threat.
212,19,2025-10-04,Detail somebody money.
213,19,2025-07-02,The whom data power change way.
214,50,2025-10-07,Single Congress everybody usually air at.
215,21,2025-01-10,Fast father choose before walk society.
216,10,2025-10-02,Store recently continue information ready any class.
217,3,2025-07-07,Detail water parent race remain future.
218,32,2025-11-14,Weight away building speech player medical.
219,45,2025-08-21,Onto sometimes value sit price toward.
220,21,2025-10-20,Of read Mrs production name resource girl.
221,34,2025-05-12,Power night light many threat.
222,23,2025-06-18,Yes agreement politics draw finish catch price.
223,46,2025-05-21,Right beat company product party plant.
224,2,2025-02-27,Before rest Mr idea.
225,35,2025-08-30,Former reduce course quite federal.
226,46,2025-04-23,Position let deal appear win piece firm.
227,42,2024-12-19,Study break protect hear hit exactly stage.
228,11,2025-10-13,Arm thank as former pretty must stock.
229,40,2025-03-26,Military former modern.
230,16,2025-10-13,Allow open anything state best.
231,19,2025-05-10,Reason sing me tree whom.
232,15,2025-09-24,Whether concern floor local school.
233,32,2024-12-12,Herself film without kitchen describe.
234,29,2025-11-05,Trade religious compare through summer.
235,9,2025-02-08,To only will quality.
236,7,2024-12-03,Girl his plant role common.
237,28,2025-08-14,Just last unit.
238,14,2025-05-28,Imagine senior mention wrong gas himself your.
239,33,2025-01-11,Oil entire group draw space TV clear peace.
240,21,2025-02-08,Allow now stuff.
241,8,2024-12-11,Begin that ask part level two.
242,7,2025-08-12,Power prevent source popular answer simple remain.
243,19,2025-09-19,Hot executive every social create word.
244,37,2025-02-27,Out factor high believe step area.
245,19,2025-09-28,Benefit behind even someone perform anyone.
246,47,2025-09-17,Professor project key attorney at.
247,14,2024-12-10,Book call provide sign.
248,5,2024-12-07,Financial Mr live home everyone conference.
249,45,2025-10-02,Night interview nation whom year industry.
250,36,2025-10-10,Republican far almost item.
251,34,2025-08-13,Clear among trouble human single I situation.
252,32,2025-07-04,Member east their staff level.
253,31,2025-06-26,A radio number professor nothing thus suffer any.
254,29,2025-08-10,Myself mind moment season.
255,48,2025-03-04,Truth tree buy someone moment thing model.
256,26,2025-07-25,Less young whether in bit drive next.
257,9,2025-01-15,Yes coach article individual fine field institution.
258,3,2025-07-09,Phone use understand policy have.
259,42,2025-08-13,Use must general benefit economic media physical.
260,10,2025-10-24,Pay trade trade let research PM both sure.
261,8,2025-05-15,Participant spend page.
262,23,2024-12-16,Line through minute character.
263,39,2025-04-15,Shoulder stage career baby drop billion.
264,35,2025-07-01,All decide result toward police wish apply.
265,21,2025-11-11,Agency know control lose analysis Democrat.
266,15,2025-06-29,Claim federal player art foot.
267,36,2025-06-17,Congress even at particularly.
268,5,2025-07-14,Team military into forget pay.
269,47,2025-02-08,Nor down notice effect then try eat.
270,47,2025-04-11,American box wonder.
271,13,2025-10-06,Mouth must bar indeed position.
272,20,2025-01-09,Large practice there feeling expert.
273,11,2025-03-30,Sign myself study thank movie page.
274,28,2024-11-20,Direction fish to part concern age.
275,15,2025-01-12,Government argue start cup both natural.
276,7,2025-02-03,Similar natural small significant example administration reach.
277,21,2025-07-05,Big thank rate sing.
278,34,2025-02-17,Fall option church sort painting fund.
279,45,2025-06-20,Company involve put arrive range become my ever.
280,33,2025-10-21,Buy itself book natural ok gas hear.
281,4,2025-01-29,Wish food firm usually.
282,32,2025-10-14,Garden number time before second certain.
283,40,2025-09-28,Seat alone price radio.
284,24,2025-09-02,Entire data necessary ok military.
285,6,2025-06-05,Prevent thousand quickly forget what just wall.
286,50,2024-12-10,Hit throw full describe could case.
287,21,2025-11-13,Music level its special book.
288,37,2025-06-16,Dinner huge serious service dog mind.
289,37,2025-09-11,Wish current out continue past.
290,46,2025-07-18,Still we check cup.
291,4,2025-05-22,Hospital risk power enjoy several tax.
292,8,2025-04-13,Main body use physical finally amount available.
293,44,2025-07-12,Station training people his fear argue mouth board.
294,34,2025-03-19,Sign whose six sound.
295,25,2025-02-24,Trial let reach.
296,39,2025-11-01,Foreign attorney cut would.
297,32,2024-12-23,Environment true baby address tend continue.
298,12,2025-10-17,Spring computer training resource.
299,22,2025-03-17,Onto picture theory certain whatever produce.
300,40,2025-11-05,Room them in thing five grow attack.
301,16,2025-09-20,Machine food trip source.
302,11,2025-09-10,Ever return eye real social ten along.
303,10,2025-08-19,Knowledge often dark news recent pattern.
304,15,2025-09-18,Already yard heavy miss Democrat establish them mind.
305,39,2024-12-11,Carry exist gun five north.
306,31,2025-01-09,This computer campaign spring discussion indeed car.
307,31,2025-10-31,Business evidence party left sing.
308,6,2024-12-17,Budget herself result yet relate staff.
309,27,2025-03-25,Thank nearly forget bit very rest move.
310,25,2024-12-09,Key trip as impact.
311,14,2025-02-10,Middle effect identify us hard rate must.
312,42,2025-02-28,Identify garden water mother factor.
313,44,2024-12-13,Fight base official one.
314,45,2025-05-31,Enter theory tax until environmental particular.
315,39,2025-02-18,Focus expert participant door firm record under few.
316,8,2025-05-28,Sing major billion toward trip single use.
317,6,2025-08-19,Wait mention raise.
318,42,2025-01-01,Someone explain name lead term all marriage.
319,43,2025-06-08,Follow there three watch move heavy stay focus.
320,4,2025-02-28,Face interview allow indicate offer close.
321,19,2025-01-25,Experience recent above leave sometimes per.
322,15,2025-04-23,American note common charge.
323,10,2025-10-21,Manager hear interview experience.
324,48,2025-03-19,Might source physical might bill investment.
325,49,2025-06-30,Learn six man involve human outside director second.
326,16,2025-05-10,I scene out news.
327,44,2024-12-24,High pick relate cut focus.
328,39,2025-05-21,Method minute kitchen both debate five peace southern.
329,17,2025-08-24,Democrat skill member analysis city office.
330,41,2025-04-21,Situation trip design it.
331,10,2025-05-26,Any rather theory energy increase.
332,44,2025-07-27,Five edge first none.
333,8,2025-02-16,Up either sign prepare.
334,11,2024-12-17,Field return difference lose southern else friend.
335,43,2025-01-14,Tv child my hotel total building hold.
336,37,2025-04-06,Medical each manage personal continue act knowledge.
337,20,2025-01-09,Ten color nearly know.
338,37,2024-12-13,Bed card beyond father care big even chance.
339,10,2025-01-16,Likely week anyone serve college window.
340,9,2024-12-25,Pull tough around organization strong task.
341,38,2024-12-20,Material read similar turn wonder budget guess.
342,38,2025-01-24,War middle low law.
343,10,2025-08-19,Air authority teacher trade house learn.
344,38,2025-03-26,Hard visit remain major century middle third share.
345,6,2025-04-02,All top join third between at.
346,20,2025-10-01,Including very generation fast.
347,43,2025-02-06,Deal day general itself.
348,28,2025-11-19,Help argue star step step.
349,27,2025-01-15,Require either issue cultural.
350,48,2025-08-19,Republican action begin next.
351,7,2025-03-22,Talk rule give mean degree.
352,13,2025-08-13,Then per easy wall.
353,27,2025-06-04,Table conference cause keep myself deep most.
354,46,2024-12-29,Unit bed PM street although move.
355,12,2025-02-28,Goal capital each.
356,34,2025-07-11,Case newspaper attack human middle.
357,36,2025-03-09,Protect whole oil husband second military.
358,17,2025-08-17,More might night night firm market table.
359,37,2025-04-10,Third heavy play teacher.
360,1,2025-10-21,Fish issue foreign relationship cut forget government.
361,33,2025-03-15,Gas worry challenge force.
362,11,2025-08-19,Actually pay education including full.
363,12,2025-03-17,Population go let same.
364,22,2025-05-13,Professional tonight successful along.
365,33,2024-11-26,Bed result peace several.
366,4,2025-11-01,Population despite summer site best.
367,47,2025-07-14,Few with to young learn newspaper bring.
368,22,2025-07-27,Reason member TV none son military.
369,1,2025-03-24,Similar animal tree close least.
370,13,2025-10-13,Bank source society war pick offer goal middle.
371,20,2025-10-04,Few maybe career place interview rock.
372,17,2025-08-20,Size allow expert light.
373,23,2025-06-26,College themselves central decide alone stock.
374,27,2025-08-04,Rich know west serious.
375,31,2025-03-15,Partner character your low onto about.
376,40,2025-05-14,Agent option strong ten military sound many.
377,42,2025-09-02,Country human we score man sound town.
378,6,2025-09-29,Sign both house born.
379,41,2025-07-04,Sense month condition general.
380,40,2025-03-30,Spring will budget.
381,43,2025-05-19,Indeed exist site few.
382,48,2025-11-12,She road establish fight friend poor plan.
383,44,2025-06-08,Discuss college also team.
384,49,2025-07-29,Mention as miss later.
385,11,2025-10-17,Cold entire again owner.
386,4,2025-07-22,Today next former describe reason address.
387,38,2025-11-11,Fall type because meeting remain.
388,41,2025-09-13,Media picture great baby administration.
389,9,2025-06-29,Democratic hour unit mention player hard end.
390,14,2025-11-14,Conference instead civil life yard someone vote follow.
391,6,2025-09-12,Least finally imagine job mission scene when.
392,45,2025-04-08,Whole skill performance tree bring.
393,50,2025-06-18,Happy look Republican several arrive nearly.
394,15,2025-10-12,Step plan model next participant.
395,41,2025-08-19,Building car their network hold look.
396,14,2025-01-18,Not she international system then force.
397,35,2025-01-11,Happy begin blue year bring go like born.
398,12,2025-02-12,Sport bit only television.
399,42,2025-07-04,Concern food toward medical seven great tree current.
400,43,2025-02-21,Should sure court data plan bad.
401,13,2025-03-20,Political line fund four training assume offer.
402,31,2024-12-10,Production individual federal medical.
403,34,2025-03-06,Watch pattern science.
404,36,2024-11-19,Drug large establish economic.
405,31,2025-08-02,Field stop serve show chance run.
406,33,2025-06-12,Mr course think.
407,41,2025-11-12,Story subject bill.
408,37,2025-07-31,Herself bill friend certain.
409,44,2025-08-24,Trial food sister place certainly call approach.
410,20,2025-08-19,Baby partner large into group interest.
411,41,2025-07-08,Special assume war scene sure traditional generation.
412,44,2025-05-05,Few personal feeling.
413,13,2025-08-20,Discuss church act none.
414,31,2025-07-03,Meet participant window series test catch lay.
415,9,2025-10-16,Buy himself different agent clearly answer.
416,2,2025-10-24,For glass could generation black.
417,47,2025-04-28,Line discuss current natural which eat teach.
418,45,2025-09-13,Big program fire.
419,32,2024-12-25,Music by receive in laugh home involve.
420,6,2025-01-09,Owner front parent church behind my.
421,14,2025-02-19,Leader actually explain week their.
422,18,2025-01-23,Mean hear whatever begin race listen system.
423,27,2025-08-11,Five theory clear seven.
424,1,2025-06-28,Management affect body.
425,26,2025-03-05,Respond feel avoid concern him event many.
426,29,2025-01-05,Foreign according nothing.
427,9,2025-01-10,Score kind social note.
428,24,2025-09-15,Expect stay trip run onto economy plant generation.
429,32,2025-03-01,Truth official within base.
430,25,2025-06-02,Paper way your anyone.
431,29,2025-04-21,Government role region color act.
432,42,2025-05-12,History artist imagine watch evening sport.
433,8,2025-08-23,Money then attention hour buy.
434,49,2025-09-30,Yard walk no.
435,7,2025-04-05,Week education kind certainly whose your century.
436,39,2025-10-27,Join people it attention send.
437,1,2025-05-23,Oil turn toward idea chair American line.
438,5,2024-11-21,Push successful ask.
439,11,2025-01-21,Away movie establish voice figure.
440,2,2025-07-02,White mind address.
441,38,2025-01-07,Threat true somebody thus move Mr.
442,42,2024-12-19,Poor size radio simply TV find say.
443,4,2025-08-30,Specific office agent back room.
444,50,2025-05-21,Campaign break source street morning money contain.
445,15,2025-08-08,Name firm future piece sing pay general meeting.
446,39,2025-10-06,Serve accept choose.
447,1,2025-03-13,Now still name model stop week head.
448,6,2025-10-17,Put health above film modern together debate.
449,22,2025-08-30,Seven Congress garden area market.
450,29,2025-08-22,Shake myself upon.
451,29,2025-01-19,Nation maintain focus east else matter.
452,11,2025-06-07,Ground field either pick.
453,37,2025-08-02,Rest form special.
454,14,2025-02-10,Open owner rate long gas attack.
455,27,2025-07-30,Score choice you generation perhaps wife hair.
456,42,2025-06-30,Perform push coach hundred few space billion.
457,9,2024-12-12,On address different happy west possible nor.
458,47,2025-08-14,Activity often suffer leg term boy next.
459,36,2025-06-25,Meeting assume fast cause step guy.
460,23,2025-04-20,Cover building simple.
461,12,2025-08-20,Collection mention board court.
462,18,2025-05-04,But born amount art use yet.
463,18,2025-07-29,Ball expert top positive up heart seven.
464,44,2025-06-24,Protect laugh start tree conference every former.
465,46,2024-12-05,Performance food score continue threat.
466,3,2025-07-10,Issue station stage.
467,46,2025-08-12,Hotel week how choice similar.
468,21,2025-04-28,Theory he difference throw.
469,8,2025-06-18,Cover reality worker friend certain.
470,43,2025-08-28,Morning include speak hand popular.
471,16,2025-04-16,One sing drug.
472,28,2025-06-24,Draw discuss if spend.
473,4,2025-05-14,New increase they born part.
474,23,2025-02-07,Him with rest decide place indeed learn no.
475,8,2025-01-02,Little question compare add policy skin.
476,3,2025-03-07,Home return surface before above.
477,19,2025-06-15,Even among build prevent allow American.
478,10,2025-04-02,Sea democratic great baby.
479,16,2025-05-22,Social customer possible know store letter season.
480,32,2025-07-14,Partner office huge green.
481,15,2024-12-01,Treatment five throw recent someone direction.
482,49,2025-11-14,Record analysis follow most.
